{
  "version": "1.0",
  "id": "comparative-epistemology",
  "title": "Comparative Epistemology Base",
  "description": "An inheritance root for disciplined comparisons between scientific, philosophical, contemplative and symbolic models.",
  "extends": [
    "base"
  ],
  "defaultTheme": "whiteScientific",
  "themes": [],
  "assets": [],
  "mechanisms": [],
  "selectionPolicy": {
    "preferredSemanticTags": [
      "comparison",
      "evidence",
      "model",
      "divergence",
      "convergence",
      "inquiry"
    ],
    "epistemicRule": "Never merge ontological categories merely because diagrams align functionally."
  }
}
